{
  "counts": {
    "f4_f6_cells_executed": 0,
    "f4_f6_cells_intended": 75,
    "gaps": 160,
    "oracle_cells_executed": 0,
    "oracle_cells_intended": 160,
    "task_ids_distinct": 30,
    "tasks_in": 30,
    "tasks_out": 30
  },
  "future_protected_role_receipt_target": {
    "by_family": {
      "F-4": {
        "roles": [
          "observed",
          "proposed"
        ],
        "target": 10
      },
      "F-5": {
        "roles": [
          "legacy",
          "canonical"
        ],
        "target": 10
      },
      "F-6": {
        "roles": [
          "explained_source"
        ],
        "target": 5
      }
    },
    "executed": 0,
    "status": "planning_target_not_evidence",
    "target": 25
  },
  "input_pins": {
    "benchmark_plan": "sha256:823546482e8bc698dd54192f42817a94ab8c0fadb4350100b2f8d9ec4624fee1",
    "blocker_map": "sha256:de6924d31de844e25cd09bb4a056104be62fbdbd04e7b9349867e174b1361919",
    "closure": "sha256:887e033ffee1fc35e1e0eb23e5d2696a1ddcd7f9d2fd5bcc6b363e77e2ddcf1a"
  },
  "manifest_hash": "sha256:e382ef9984482b8df15d4581fecf011cdbce26265bdb10e79a3b14f8a7c824a0",
  "manifest_id": "w1/slice-30-oracle-receipts-v1",
  "schema_version": 1,
  "source_revision": "a2dde2b191f6b78c2003d74875560da782470968",
  "status": "unexecuted_evidence_only",
  "tasks": [
    {
      "closure_status": "computed_not_sealed",
      "family": "F-1",
      "intended_oracles": [
        "parse",
        "link",
        "validate",
        "compile",
        "semantic"
      ],
      "leakage_group_id": "sha256:2efe88f1ec36ca151c15a728db8623de4e8a34628ad3aaf60c76ae10ea170c47",
      "mode": "author",
      "oracle_cells": [
        {
          "authority": null,
          "predicate": "parse",
          "receipt_ref": null,
          "receipt_sha256": null,
          "status": "not_run"
        },
        {
          "authority": null,
          "predicate": "link",
          "receipt_ref": null,
          "receipt_sha256": null,
          "status": "not_run"
        },
        {
          "authority": null,
          "predicate": "validate",
          "receipt_ref": null,
          "receipt_sha256": null,
          "status": "not_run"
        },
        {
          "authority": null,
          "predicate": "compile",
          "receipt_ref": null,
          "receipt_sha256": null,
          "status": "not_run"
        },
        {
          "authority": null,
          "predicate": "semantic",
          "receipt_ref": null,
          "receipt_sha256": null,
          "status": "not_run"
        }
      ],
      "source_blob_oid": "23b58e42fd06167a1cdea7a22a89ce91f70571a6",
      "source_path": "examples/play-prod-v2/properties/search/main.metis",
      "task_id": "slice-0001/f1-01"
    },
    {
      "closure_status": "computed_not_sealed",
      "family": "F-1",
      "intended_oracles": [
        "parse",
        "link",
        "validate",
        "compile",
        "semantic"
      ],
      "leakage_group_id": "sha256:2efe88f1ec36ca151c15a728db8623de4e8a34628ad3aaf60c76ae10ea170c47",
      "mode": "author",
      "oracle_cells": [
        {
          "authority": null,
          "predicate": "parse",
          "receipt_ref": null,
          "receipt_sha256": null,
          "status": "not_run"
        },
        {
          "authority": null,
          "predicate": "link",
          "receipt_ref": null,
          "receipt_sha256": null,
          "status": "not_run"
        },
        {
          "authority": null,
          "predicate": "validate",
          "receipt_ref": null,
          "receipt_sha256": null,
          "status": "not_run"
        },
        {
          "authority": null,
          "predicate": "compile",
          "receipt_ref": null,
          "receipt_sha256": null,
          "status": "not_run"
        },
        {
          "authority": null,
          "predicate": "semantic",
          "receipt_ref": null,
          "receipt_sha256": null,
          "status": "not_run"
        }
      ],
      "source_blob_oid": "6bb22cb05488720bfe3dccc5768cb342e0c71577",
      "source_path": "examples/play-prod-v2/properties/sky/sky_featured.metis",
      "task_id": "slice-0001/f1-02"
    },
    {
      "closure_status": "computed_not_sealed",
      "family": "F-1",
      "intended_oracles": [
        "parse",
        "link",
        "validate",
        "compile",
        "semantic"
      ],
      "leakage_group_id": "sha256:2efe88f1ec36ca151c15a728db8623de4e8a34628ad3aaf60c76ae10ea170c47",
      "mode": "author",
      "oracle_cells": [
        {
          "authority": null,
          "predicate": "parse",
          "receipt_ref": null,
          "receipt_sha256": null,
          "status": "not_run"
        },
        {
          "authority": null,
          "predicate": "link",
          "receipt_ref": null,
          "receipt_sha256": null,
          "status": "not_run"
        },
        {
          "authority": null,
          "predicate": "validate",
          "receipt_ref": null,
          "receipt_sha256": null,
          "status": "not_run"
        },
        {
          "authority": null,
          "predicate": "compile",
          "receipt_ref": null,
          "receipt_sha256": null,
          "status": "not_run"
        },
        {
          "authority": null,
          "predicate": "semantic",
          "receipt_ref": null,
          "receipt_sha256": null,
          "status": "not_run"
        }
      ],
      "source_blob_oid": "1b27f647d272affaaa94a16bddf2e09019c7a5b4",
      "source_path": "examples/play-prod-v2/properties/dem/dem_test.metis",
      "task_id": "slice-0001/f1-03"
    },
    {
      "closure_status": "computed_not_sealed",
      "family": "F-1",
      "intended_oracles": [
        "parse",
        "link",
        "validate",
        "compile",
        "semantic"
      ],
      "leakage_group_id": "sha256:2efe88f1ec36ca151c15a728db8623de4e8a34628ad3aaf60c76ae10ea170c47",
      "mode": "author",
      "oracle_cells": [
        {
          "authority": null,
          "predicate": "parse",
          "receipt_ref": null,
          "receipt_sha256": null,
          "status": "not_run"
        },
        {
          "authority": null,
          "predicate": "link",
          "receipt_ref": null,
          "receipt_sha256": null,
          "status": "not_run"
        },
        {
          "authority": null,
          "predicate": "validate",
          "receipt_ref": null,
          "receipt_sha256": null,
          "status": "not_run"
        },
        {
          "authority": null,
          "predicate": "compile",
          "receipt_ref": null,
          "receipt_sha256": null,
          "status": "not_run"
        },
        {
          "authority": null,
          "predicate": "semantic",
          "receipt_ref": null,
          "receipt_sha256": null,
          "status": "not_run"
        }
      ],
      "source_blob_oid": "07ca0d02b056e8070a863841fa8696a5f5c28a8b",
      "source_path": "examples/play-prod-v2/properties/snap/stagioni_prima_serata.metis",
      "task_id": "slice-0001/f1-04"
    },
    {
      "closure_status": "computed_not_sealed",
      "family": "F-1",
      "intended_oracles": [
        "parse",
        "link",
        "validate",
        "compile",
        "semantic"
      ],
      "leakage_group_id": "sha256:2efe88f1ec36ca151c15a728db8623de4e8a34628ad3aaf60c76ae10ea170c47",
      "mode": "author",
      "oracle_cells": [
        {
          "authority": null,
          "predicate": "parse",
          "receipt_ref": null,
          "receipt_sha256": null,
          "status": "not_run"
        },
        {
          "authority": null,
          "predicate": "link",
          "receipt_ref": null,
          "receipt_sha256": null,
          "status": "not_run"
        },
        {
          "authority": null,
          "predicate": "validate",
          "receipt_ref": null,
          "receipt_sha256": null,
          "status": "not_run"
        },
        {
          "authority": null,
          "predicate": "compile",
          "receipt_ref": null,
          "receipt_sha256": null,
          "status": "not_run"
        },
        {
          "authority": null,
          "predicate": "semantic",
          "receipt_ref": null,
          "receipt_sha256": null,
          "status": "not_run"
        }
      ],
      "source_blob_oid": "30f6359acdb65b0982c4f947fb0c73dc08a21666",
      "source_path": "examples/play-prod-v2/properties/play/main_2.metis",
      "task_id": "slice-0001/f1-05"
    },
    {
      "closure_status": "computed_not_sealed",
      "family": "F-2",
      "intended_oracles": [
        "patch_minimality",
        "parse",
        "link",
        "validate",
        "compile",
        "semantic"
      ],
      "leakage_group_id": "sha256:2efe88f1ec36ca151c15a728db8623de4e8a34628ad3aaf60c76ae10ea170c47",
      "mode": "edit",
      "oracle_cells": [
        {
          "authority": null,
          "predicate": "patch_minimality",
          "receipt_ref": null,
          "receipt_sha256": null,
          "status": "not_run"
        },
        {
          "authority": null,
          "predicate": "parse",
          "receipt_ref": null,
          "receipt_sha256": null,
          "status": "not_run"
        },
        {
          "authority": null,
          "predicate": "link",
          "receipt_ref": null,
          "receipt_sha256": null,
          "status": "not_run"
        },
        {
          "authority": null,
          "predicate": "validate",
          "receipt_ref": null,
          "receipt_sha256": null,
          "status": "not_run"
        },
        {
          "authority": null,
          "predicate": "compile",
          "receipt_ref": null,
          "receipt_sha256": null,
          "status": "not_run"
        },
        {
          "authority": null,
          "predicate": "semantic",
          "receipt_ref": null,
          "receipt_sha256": null,
          "status": "not_run"
        }